{
    "experimentId":  "EXP-007",
    "protocolVersion":  "COLLATERAL_EVIDENCE_V1",
    "collateralCount":  1,
    "collaterals":  [
                        {
                            "testName":  "AuthorApiIntegrationTest.testGetAuthorById_Snapshot",
                            "snapshotName":  "AuthorApiIntegrationTest.testGetAuthorById_Snapshot.approved.txt",
                            "approved":  {
                                             "path":  "collateral/AuthorApiIntegrationTest.testGetAuthorById_Snapshot/approved.txt",
                                             "sha256":  "2511d0173d85da0b2b70faddbc079a5ff24be8206b82275d18a462189af44feb"
                                         },
                            "received":  {
                                             "path":  "collateral/AuthorApiIntegrationTest.testGetAuthorById_Snapshot/received.txt",
                                             "sha256":  "fe6fcd828f839b1e648370919bd18e58f7c2cd73317579656796eef6e44bb39c"
                                         },
                            "testOutput":  {
                                               "path":  "collateral/AuthorApiIntegrationTest.testGetAuthorById_Snapshot/test-output.txt",
                                               "sha256":  "90b8f0f56bec6fa9b15b6bbccbf30ecc3f16df11069c92cccab6e44937037857"
                                           },
                            "evidencePreservedInFull":  true
                        }
                    ],
    "includedInLlmInput":  false
}
